<?xml version="1.0" encoding="UTF-8"?>
<xs:schema xmlns:xs="http://www.w3.org/2001/XMLSchema">
  <xs:element name="specifications">
    <xs:complexType>
      <xs:sequence>
        <xs:element name="specification" maxOccurs="unbounded">
          <xs:complexType>
            <xs:attribute name="key" use="required">
              <xs:simpleType>
                <xs:restriction base="xs:NMTOKEN">
                  <xs:pattern value="[a-z\-]+"/>
                </xs:restriction>
              </xs:simpleType>
            </xs:attribute>
            <xs:attribute name="name" use="required">
              <xs:simpleType>
                <xs:restriction base="xs:string">
                  <xs:pattern value="[A-Z][^\s]*([\s]+[^\s]+)*"/>
                </xs:restriction>
              </xs:simpleType>
            </xs:attribute>
            <xs:attribute name="deprecated" type="xs:boolean" default="false"/>
          </xs:complexType>
        </xs:element>
      </xs:sequence>
      <xs:attribute name="familyPrefix" use="optional">
        <xs:simpleType>
          <xs:restriction base="xs:NMTOKEN">
            <xs:pattern value="[A-Z]+\-"/>
          </xs:restriction>
        </xs:simpleType>
      </xs:attribute>
    </xs:complexType>
  </xs:element>
</xs:schema>
