<?xml version="1.0" encoding="UTF-8"?>
<!--WARNING: This is a generated file.  It is derived from all other SPEC-* files.  DO NOT EDIT.-->
<specifications xmlns:xsi="http://www.w3.org/2001/XMLSchema-instance" xsi:noNamespaceSchemaLocation="schemas/specificationList.xsd">
<specification key="CDA-core" name="Clinical Document Architecture (CDA) Core"/>
<specification key="CDA-someig" name="Some CDA IG"/>
<specification key="FHIR-core" name="FHIR Core"/>
<specification key="FHIR-fhirpath" name="FHIRPath"/>
<specification key="FHIR-smart" name="SMART on FHIR"/>
<specification key="FHIR-ecr" name="Electronic Case Reporting"/>
<specification key="FHIR-genomics-reporting" name="Genomics Reporting"/>
<specification key="FHIR-immds" name="CDS Immunization Forecast"/>
<specification key="FHIR-ips" name="International Patient Summary"/>
<specification key="FHIR-phd" name="Personal Healthcare Devices"/>
<specification key="FHIR-pocd" name="Point of Care Devices"/>
<specification key="FHIR-sdc" name="Structured Data Capture (SDC)"/>
<specification key="FHIR-sdc-de" name="Structured Data Capture (SDC-DE)"/>
<specification key="FHIR-vhdir" name="Validated Healthcare Directory"/>
<specification key="FHIR-us-core" name="US Core"/>
<specification key="FHIR-us-breastcancer" name="US Breast Cancer"/>
<specification key="FHIR-us-ccda" name="US C-CDA on FHIR"/>
<specification key="FHIR-us-daf-research" name="US DAF Research"/>
<specification key="FHIR-us-hai" name="US Healthcare Associated Infections"/>
<specification key="FHIR-us-pharmacy" name="US Pharmacy"/>
<specification key="FHIR-us-qicore" name="US QI Core"/>
<specification key="FHIR-cqif" name="Clinical Quality Information Framework (CQIF)" deprecated="true"/>
<specification key="FHIR-gao" name="Guideline Appropriate Ordering (GAO)" deprecated="true"/>
<specification key="FHIR-us-argonaut" name="Argonaut (do not use)" deprecated="true"/>
<specification key="FHIR-us-lab" name="US Lab" deprecated="true"/>
</specifications>
